<ValuesHighRes  xmlns:xsi='http://www.w3.org/2001/XMLSchema-instance' xsi:noNamespaceSchemaLocation='http://schemas.benchmark-harness.org/ValuesHighRes.xsd' v='' V='1.02'><ID id='0' name='Loop' type='method' package='TestServer' modifiers=''/><ID id='1' name='Max' type='method' package='TestServer' modifiers=''/><ID id='2' name='Min' type='method' package='TestServer' modifiers='2|1'/><T _i='0' _m='E'><V n='1' v='10'/><V n='2' v='15'/><V n='3' v='3'/><V n='4' v='4'/></T><T _i='2' _m='E'><V n='1' v='15'/></T><T _i='2' _m='X'><V n='0' v='ARRAY'/></T><T _i='2' _m='E'><V n='1' v='4'/></T><T _i='2' _m='X'><V n='0' v='ARRAY'/></T><T _i='0' _m='X'><V n='0' v='ARRAY'/></T><T _i='0' _m='E'><V n='1' v='10'/><V n='2' v='15'/><V n='3' v='3'/><V n='4' v='4'/></T><T _i='2' _m='E'><V n='1' v='3'/></T><T _i='2' _m='X'><V n='0' v='ARRAY'/></T><T _i='0' _m='X'><V n='0' v='ARRAY'/></T><T _i='0' _m='E'><V n='1' v='10'/><V n='2' v='15'/><V n='3' v='3'/><V n='4' v='4'/></T><T _i='2' _m='E'><V n='1' v='15'/></T><T _i='2' _m='X'><V n='0' v='ARRAY'/></T><T _i='2' _m='E'><V n='1' v='4'/></T><T _i='2' _m='X'><V n='0' v='ARRAY'/></T><T _i='0' _m='X'><V n='0' v='ARRAY'/></T><T _i='0' _m='E'><V n='1' v='10'/><V n='2' v='15'/><V n='3' v='3'/><V n='4' v='4'/></T><T _i='2' _m='E'><V n='1' v='3'/></T><T _i='2' _m='X'><V n='0' v='ARRAY'/></T><T _i='0' _m='X'><V n='0' v='ARRAY'/></T><T _i='0' _m='E'><V n='1' v='10'/><V n='2' v='15'/><V n='3' v='3'/><V n='4' v='4'/></T><T _i='2' _m='E'><V n='1' v='15'/></T><T _i='2' _m='X'><V n='0' v='ARRAY'/></T><T _i='2' _m='E'><V n='1' v='4'/></T><T _i='2' _m='X'><V n='0' v='ARRAY'/></T><T _i='0' _m='X'><V n='0' v='ARRAY'/></T><T _i='0' _m='E'><V n='1' v='10'/><V n='2' v='15'/><V n='3' v='3'/><V n='4' v='4'/></T><T _i='2' _m='E'><V n='1' v='3'/></T><T _i='2' _m='X'><V n='0' v='ARRAY'/></T><T _i='0' _m='X'><V n='0' v='ARRAY'/></T><T _i='0' _m='E'><V n='1' v='10'/><V n='2' v='15'/><V n='3' v='3'/><V n='4' v='4'/></T><T _i='2' _m='E'><V n='1' v='15'/></T><T _i='2' _m='X'><V n='0' v='ARRAY'/></T><T _i='2' _m='E'><V n='1' v='4'/></T><T _i='2' _m='X'><V n='0' v='ARRAY'/></T><T _i='0' _m='X'><V n='0' v='ARRAY'/></T><T _i='0' _m='E'><V n='1' v='10'/><V n='2' v='15'/><V n='3' v='3'/><V n='4' v='4'/></T><T _i='2' _m='E'><V n='1' v='3'/></T><T _i='2' _m='X'><V n='0' v='ARRAY'/></T><T _i='0' _m='X'><V n='0' v='ARRAY'/></T><T _i='0' _m='E'><V n='1' v='10'/><V n='2' v='15'/><V n='3' v='3'/><V n='4' v='4'/></T><T _i='2' _m='E'><V n='1' v='15'/></T><T _i='2' _m='X'><V n='0' v='ARRAY'/></T><T _i='2' _m='E'><V n='1' v='4'/></T><T _i='2' _m='X'><V n='0' v='ARRAY'/></T><T _i='0' _m='X'><V n='0' v='ARRAY'/></T><T _i='0' _m='E'><V n='1' v='10'/><V n='2' v='15'/><V n='3' v='3'/><V n='4' v='4'/></T><T _i='2' _m='E'><V n='1' v='3'/></T><T _i='2' _m='X'><V n='0' v='ARRAY'/></T><T _i='0' _m='X'><V n='0' v='ARRAY'/></T><T _i='0' _m='E'><V n='1' v='10'/><V n='2' v='15'/><V n='3' v='3'/><V n='4' v='4'/></T><T _i='2' _m='E'><V n='1' v='15'/></T><T _i='2' _m='X'><V n='0' v='ARRAY'/></T><T _i='2' _m='E'><V n='1' v='4'/></T><T _i='2' _m='X'><V n='0' v='ARRAY'/></T><T _i='0' _m='X'><V n='0' v='ARRAY'/></T><T _i='0' _m='E'><V n='1' v='10'/><V n='2' v='15'/><V n='3' v='3'/><V n='4' v='4'/></T><T _i='2' _m='E'><V n='1' v='3'/></T><T _i='2' _m='X'><V n='0' v='ARRAY'/></T><T _i='0' _m='X'><V n='0' v='ARRAY'/></T><T _i='0' _m='E'><V n='1' v='10'/><V n='2' v='15'/><V n='3' v='3'/><V n='4' v='4'/></T><T _i='2' _m='E'><V n='1' v='15'/></T><T _i='2' _m='X'><V n='0' v='ARRAY'/></T><T _i='2' _m='E'><V n='1' v='4'/></T><T _i='2' _m='X'><V n='0' v='ARRAY'/></T><T _i='0' _m='X'><V n='0' v='ARRAY'/></T><T _i='0' _m='E'><V n='1' v='10'/><V n='2' v='15'/><V n='3' v='3'/><V n='4' v='4'/></T><T _i='2' _m='E'><V n='1' v='3'/></T><T _i='2' _m='X'><V n='0' v='ARRAY'/></T><T _i='0' _m='X'><V n='0' v='ARRAY'/></T><T _i='0' _m='E'><V n='1' v='10'/><V n='2' v='15'/><V n='3' v='3'/><V n='4' v='4'/></T><T _i='2' _m='E'><V n='1' v='15'/></T><T _i='2' _m='X'><V n='0' v='ARRAY'/></T><T _i='2' _m='E'><V n='1' v='4'/></T><T _i='2' _m='X'><V n='0' v='ARRAY'/></T><T _i='0' _m='X'><V n='0' v='ARRAY'/></T><T _i='0' _m='E'><V n='1' v='10'/><V n='2' v='15'/><V n='3' v='3'/><V n='4' v='4'/></T><T _i='2' _m='E'><V n='1' v='3'/></T><T _i='2' _m='X'><V n='0' v='ARRAY'/></T><T _i='0' _m='X'><V n='0' v='ARRAY'/></T><T _i='0' _m='E'><V n='1' v='10'/><V n='2' v='15'/><V n='3' v='3'/><V n='4' v='4'/></T><T _i='2' _m='E'><V n='1' v='15'/></T><T _i='2' _m='X'><V n='0' v='ARRAY'/></T><T _i='2' _m='E'><V n='1' v='4'/></T><T _i='2' _m='X'><V n='0' v='ARRAY'/></T><T _i='0' _m='X'><V n='0' v='ARRAY'/></T><T _i='0' _m='E'><V n='1' v='10'/><V n='2' v='15'/><V n='3' v='3'/><V n='4' v='4'/></T><T _i='2' _m='E'><V n='1' v='3'/></T><T _i='2' _m='X'><V n='0' v='ARRAY'/></T><T _i='0' _m='X'><V n='0' v='ARRAY'/></T><T _i='0' _m='E'><V n='1' v='10'/><V n='2' v='15'/><V n='3' v='3'/><V n='4' v='4'/></T><T _i='2' _m='E'><V n='1' v='15'/></T><T _i='2' _m='X'><V n='0' v='ARRAY'/></T><T _i='2' _m='E'><V n='1' v='4'/></T><T _i='2' _m='X'><V n='0' v='ARRAY'/></T><T _i='0' _m='X'><V n='0' v='ARRAY'/></T><T _i='0' _m='E'><V n='1' v='10'/><V n='2' v='15'/><V n='3' v='3'/><V n='4' v='4'/></T><T _i='2' _m='E'><V n='1' v='3'/></T><T _i='2' _m='X'><V n='0' v='ARRAY'/></T><T _i='0' _m='X'><V n='0' v='ARRAY'/></T></ValuesHighRes>